{
  "name": "terminal",
  "description": "Zsh, Oh My Zsh, and terminal configuration",
  "category": "core",
  "version": "1.0.0",
  "dependencies": ["homebrew"],
  "conflicts": [],
  "stow_packages": ["zsh", "bin"],
  "scripts": {
    "install": "modules/terminal/install.sh",
    "uninstall": "modules/terminal/uninstall.sh",
    "update": "modules/terminal/update.sh"
  },
  "profiles": ["desktop", "laptop"],
  "platforms": ["macos"],
  "requires": {
    "brew_packages": ["zsh-autosuggestions", "zsh-syntax-highlighting"]
  },
  "optional": false,
  "enabled_by_default": true,
  "tags": ["terminal", "zsh", "shell"]
}
